{
  "advisory": [
    {
      "caseIds": [],
      "documentIds": [
        "doc-error-codes",
        "doc-service-sop",
        "doc-legacy-escalation",
        "doc-onboarding-faq"
      ],
      "id": "faq-noise-docs",
      "kind": "noise_grounding",
      "note": "high SP1 with low SP2 in 09 reads as noisy sources; advisory, never decides the contrast",
      "observations": [
        {
          "SP1": 1.0,
          "SP2": 0.5,
          "caseId": "e217-response-limit"
        },
        {
          "SP1": 1.0,
          "SP2": 0.36,
          "caseId": "e503-count-threshold"
        },
        {
          "SP1": 1.0,
          "SP2": 0.67,
          "caseId": "p1-full-condition-practice"
        },
        {
          "SP1": 1.0,
          "SP2": 0.56,
          "caseId": "new-clinic-onboarding-gap"
        }
      ],
      "reading": "observed",
      "source": "current",
      "status": "advisory",
      "teachingPoint": "常见错误码手册和服务流程 SOP 文档末尾混有无关 FAQ 段落，过期升级规则和内部 FAQ 文档还携带诱饵短语，检索会把这些无关或过期内容一起召回。"
    },
    {
      "evidence": "present",
      "hits": [],
      "id": "first-conversation",
      "kind": "memory",
      "mustNotMention": [],
      "reading": "unknown",
      "sessionId": "session-92879aab-d182-4ffd-bebe-9e1e1b4c2ba7-1790575174",
      "source": "current",
      "status": "advisory",
      "teachingPoint": "Agent 还不知道提问者属于哪个 Lab，无法直接回答，需要先确认身份或追问 Lab 编号。"
    }
  ],
  "caseTable": {
    "cases": [
      {
        "baseline": {
          "combined": "pass",
          "l1": {
            "defer": [],
            "error": [],
            "fail": [],
            "unverified": [],
            "verdict": "pass"
          },
          "mtg": {
            "label": "Pass",
            "value": 1.0
          },
          "thelma": null
        },
        "caseId": "own-lab-status",
        "category": "normal",
        "comparison": {
          "combined": "pass",
          "l1": {
            "defer": [],
            "error": [],
            "fail": [],
            "unverified": [],
            "verdict": "pass"
          },
          "mtg": {
            "label": "Pass",
            "value": 1.0
          },
          "thelma": null
        },
        "evalIndex": 1,
        "kinds": [
          "tool_use"
        ],
        "label": "查询自己 Lab 状态",
        "optimized": {
          "combined": "pass",
          "l1": {
            "defer": [],
            "error": [],
            "fail": [],
            "unverified": [],
            "verdict": "pass"
          },
          "mtg": {
            "label": "Pass",
            "value": 1.0
          },
          "thelma": null
        },
        "phenomenonIds": [
          "own-lab-tool-use"
        ],
        "probe": false,
        "provenance": "sa_synthetic"
      },
      {
        "baseline": {
          "combined": "fail",
          "l1": {
            "defer": [],
            "error": [],
            "fail": [
              "mustNotMention"
            ],
            "unverified": [],
            "verdict": "fail"
          },
          "mtg": {
            "label": "Pass",
            "value": 1.0
          },
          "thelma": {
            "label": "Fail",
            "metrics": {
              "GR": 0.357,
              "RP": 0.71,
              "RQC": 1.0,
              "SD": 0.57,
              "SP1": 1.0,
              "SP2": 0.5,
              "SQC": 0.67
            },
            "value": 0.357
          }
        },
        "caseId": "e217-response-limit",
        "category": "normal",
        "comparison": {
          "combined": "pass",
          "l1": {
            "defer": [],
            "error": [],
            "fail": [],
            "unverified": [],
            "verdict": "pass"
          },
          "mtg": {
            "label": "Pass",
            "value": 1.0
          },
          "thelma": {
            "label": "Pass",
            "metrics": {
              "GR": 1.0,
              "RP": 0.71,
              "RQC": 0.67,
              "SD": 1.0,
              "SP1": 1.0,
              "SP2": 0.38,
              "SQC": 0.67
            },
            "value": 1.0
          }
        },
        "evalIndex": 4,
        "kinds": [
          "prompt_fixable"
        ],
        "label": "E-217 处理步骤与时限（探针：提示词可修复）",
        "optimized": {
          "combined": "fail",
          "l1": {
            "defer": [],
            "error": [],
            "fail": [
              "mustNotMention"
            ],
            "unverified": [],
            "verdict": "fail"
          },
          "mtg": {
            "label": "Pass",
            "value": 1.0
          },
          "thelma": {
            "label": "Fail",
            "metrics": {
              "GR": 0.692,
              "RP": 0.85,
              "RQC": 1.0,
              "SD": 0.25,
              "SP1": 1.0,
              "SP2": 0.38,
              "SQC": 0.67
            },
            "value": 0.692
          }
        },
        "phenomenonIds": [
          "prompt-fix-e217"
        ],
        "probe": true,
        "provenance": "sa_synthetic"
      },
      {
        "baseline": {
          "combined": "pass",
          "l1": {
            "defer": [],
            "error": [],
            "fail": [],
            "unverified": [],
            "verdict": "pass"
          },
          "mtg": {
            "label": "Fail",
            "value": 0.0
          },
          "thelma": {
            "label": "Pass",
            "metrics": {
              "GR": 1.0,
              "RP": 0.3,
              "RQC": 1.0,
              "SD": 0.29,
              "SP1": 1.0,
              "SP2": 0.36,
              "SQC": 0.67
            },
            "value": 1.0
          }
        },
        "caseId": "e503-count-threshold",
        "category": "normal",
        "comparison": {
          "combined": "pass",
          "l1": {
            "defer": [],
            "error": [],
            "fail": [],
            "unverified": [],
            "verdict": "pass"
          },
          "mtg": {
            "label": "Pass",
            "value": 1.0
          },
          "thelma": {
            "label": "Fail",
            "metrics": {
              "GR": 0.667,
              "RP": 1.0,
              "RQC": 1.0,
              "SD": 1.0,
              "SP1": 1.0,
              "SP2": 0.45,
              "SQC": 0.5
            },
            "value": 0.667
          }
        },
        "evalIndex": 7,
        "kinds": [
          "prompt_fixable"
        ],
        "label": "设计引擎崩溃升级门槛（探针：提示词可修复）",
        "optimized": {
          "combined": "pass",
          "l1": {
            "defer": [],
            "error": [],
            "fail": [],
            "unverified": [],
            "verdict": "pass"
          },
          "mtg": {
            "label": "Pass",
            "value": 1.0
          },
          "thelma": {
            "label": "Pass",
            "metrics": {
              "GR": 1.0,
              "RP": 1.0,
              "RQC": 0.67,
              "SD": 0.57,
              "SP1": 1.0,
              "SP2": 0.5,
              "SQC": 0.33
            },
            "value": 1.0
          }
        },
        "phenomenonIds": [
          "prompt-fix-e503"
        ],
        "probe": true,
        "provenance": "sa_synthetic"
      },
      {
        "baseline": {
          "combined": "pass",
          "l1": {
            "defer": [],
            "error": [],
            "fail": [],
            "unverified": [],
            "verdict": "pass"
          },
          "mtg": {
            "label": "Fail",
            "value": 0.0
          },
          "thelma": {
            "label": "Fail",
            "metrics": {
              "GR": 0.267,
              "RP": 0.6,
              "RQC": 0.83,
              "SD": 0.68,
              "SP1": 1.0,
              "SP2": 0.67,
              "SQC": 0.83
            },
            "value": 0.267
          }
        },
        "caseId": "p1-full-condition-practice",
        "category": "normal",
        "comparison": {
          "combined": "pass",
          "l1": {
            "defer": [],
            "error": [],
            "fail": [],
            "unverified": [],
            "verdict": "pass"
          },
          "mtg": {
            "label": "Pass",
            "value": 1.0
          },
          "thelma": {
            "label": "Fail",
            "metrics": {
              "GR": 0.6,
              "RP": 1.0,
              "RQC": 1.0,
              "SD": 0.71,
              "SP1": 1.0,
              "SP2": 0.67,
              "SQC": 1.0
            },
            "value": 0.6
          }
        },
        "evalIndex": 5,
        "kinds": [
          "prompt_fixable"
        ],
        "label": "P1 两个条件的判定门槛（探针：提示词可修复）",
        "optimized": {
          "combined": "pass",
          "l1": {
            "defer": [],
            "error": [],
            "fail": [],
            "unverified": [],
            "verdict": "pass"
          },
          "mtg": {
            "label": "Pass",
            "value": 1.0
          },
          "thelma": {
            "label": "Pass",
            "metrics": {
              "GR": 0.889,
              "RP": 1.0,
              "RQC": 1.0,
              "SD": 0.79,
              "SP1": 1.0,
              "SP2": 1.0,
              "SQC": 1.0
            },
            "value": 0.889
          }
        },
        "phenomenonIds": [
          "prompt-fix-p1-threshold"
        ],
        "probe": true,
        "provenance": "sa_synthetic"
      },
      {
        "baseline": {
          "combined": "pass",
          "l1": {
            "defer": [
              "shouldEscalate"
            ],
            "error": [],
            "fail": [],
            "unverified": [],
            "verdict": "defer"
          },
          "mtg": {
            "label": "Pass",
            "value": 1.0
          },
          "thelma": {
            "label": "Fail",
            "metrics": {
              "GR": 0.158,